,ticker,date,time,title
0,AMZN,2024-10-15,04:38PM,"Amazon launches AI tools, new capabilities for advertisers"
1,AMZN,2024-10-15,02:47PM,Jim Cramer Says Its Just a Matter of Time Before Amazon.com (NASDAQ:AMZN) Rebounds
2,AMZN,2024-10-15,02:45PM,Amazon ramps up AI chip race
3,AMZN,2024-10-15,01:47PM,Amazon Partners with Databricks in Five-Year Deal to Enhance AI Models
4,AMZN,2024-10-15,01:45PM,"Final Trades: Amazon, Apollo Global and the IYR"
6,AMZN,2024-10-15,12:45PM,Amazon strikes AI chip deal with Databricks as it looks to narrow gap with Nvidia
7,AMZN,2024-10-15,12:17PM,Truth Social Stock Jumps as Election Prediction Markets Drift Toward Trump
8,AMZN,2024-10-15,12:00PM,"Amazon unboxes advertiser capabilities spanning AI, DSP and insights"
9,AMZN,2024-10-15,11:57AM,"Google Redesigns Shopping Page With Infinite Scroll, Video"
10,AMZN,2024-10-15,11:29AM,"Google Unveils Redesigned, AI-Powered U.S. Shopping Website"
11,AMZN,2024-10-15,10:12AM,Amazon Ads Launches New AI Tools for Advertisers AI Creative Studio and Audio Generator
12,AMZN,2024-10-15,10:00AM,"Amazon Unveils Simplified Product Launch, Optimization, and Measurement Solutions for Full-funnel Performance"
13,AMZN,2024-10-15,10:00AM,Amazon DSP Announces Next-Generation Ad Tech for Precise Full-funnel Reach and Performance
14,AMZN,2024-10-15,09:00AM,Google Shopping is getting an AI upgrade as Alphabet looks to monetize investments
15,AMZN,2024-10-15,09:00AM,"Amazon Games Launches New World: Aeternum, Now Available for PlayStation 5, Xbox Series XS, and PC"
17,AMZN,2024-10-15,08:02AM,"Amazon, Databricks Strike Five-Year Deal Around AI Chips"
18,AMZN,2024-10-15,07:21AM,Will One Amazon Employee Tank the Tech Giant?
19,AMZN,2024-10-15,06:59AM,Goldman Sachs analyst revisits Amazon stock price target ahead of earnings
20,AMZN,2024-10-15,06:23AM,Google Joins Big Tech's Pivot To Nuclear Energy To Power AI
21,AMZN,2024-10-15,06:10AM,2 No-Brainer Warren Buffett Stocks to Buy Right Now
22,AMZN,2024-10-15,05:55AM,"3 No-Brainer EV Stocks to Buy With $1,000 Right Now"
23,AMZN,2024-10-15,05:15AM,The 4 Kirkland Items I'll Never Buy Again
24,AMZN,2024-10-15,04:51AM,Prediction: 2 Unstoppable Stocks That Will Beat the S&P 500 Again in 2025
25,AMZN,2024-10-15,04:50AM,3 Unstoppable Stocks to Buy With the Dow at an All-Time High
26,AMZN,2024-10-15,04:45AM,"If I Could Only Buy 2 Stocks in the Last Half of 2024, I'd Pick These"
27,AMZN,2024-10-14,08:30PM,Where Will Etsy Stock Be in 5 Years?
28,AMZN,2024-10-14,08:17PM,"Prediction: This Fashion Retail Stock Is Down 97% From Its Highs, and It Might Be Acquired Within the Next Year. Here's Why."
29,AMZN,2024-10-14,08:14PM,Artificial Intelligence (AI) Investors Get Ready for a New IPO
30,AMZN,2024-10-14,05:45PM,Amazon (AMZN) Stock Dips While Market Gains: Key Facts
31,AMZN,2024-10-14,12:32PM,Salesforce: Prime Big Deal Days falls short outside Amazon
33,AMZN,2024-10-14,11:59AM,Holiday beauty event returns to Amazon
34,AMZN,2024-10-14,11:09AM,Amazon to Deploy AI-Powered Tech to Help Delivery Drivers Find Packages
35,AMZN,2024-10-14,09:45AM,Why Amazon (AMZN) is a Top Growth Stock for the Long-Term
36,AMZN,2024-10-14,09:00AM,"Amazon.com, Inc. (AMZN) Is a Trending Stock: Facts to Know Before Betting on It"
37,AMZN,2024-10-14,08:21AM,Amazon.com Inc. (AMZN): The E-Commerce and Cloud Powerhouse for the Next Decade
38,AMZN,2024-10-14,08:00AM,Navigating Market Uncertainty: Intrinsic Value of Amazon.com Inc
39,AMZN,2024-10-14,07:00AM,Amazon Climate Fund Announces New Investments in Sustainable Innovation
40,AMZN,2024-10-14,06:57AM,Amazon will reprise holiday beauty sale
41,AMZN,2024-10-13,03:58PM,"Amazon.com, Inc. (AMZN): Hedge Funds Are Bullish On This Profitable Blue Chip Stock Right Now"
42,AMZN,2024-10-13,11:09AM,Walgreens: A New Risk Just Emerged for the Stock
43,AMZN,2024-10-13,10:23AM,"Amazon.com, Inc. (NASDAQ:AMZN) Is A Goldman Sachs Phase 2 AI Stock For The Next AI Wave"
44,AMZN,2024-10-13,08:33AM,Veteran portfolio manager reveals top return to office stock
45,AMZN,2024-10-13,08:33AM,Top return to office stock to watch
46,AMZN,2024-10-13,08:10AM,Cathie Wood Has Been Piling Into Amazon Stock. Should Investors Follow Suit?
47,AMZN,2024-10-13,08:08AM,"Amazon.com, Inc. (AMZN): Truist Raises Price Target to $265, Highlighting Resilient Consumer Demand and Strong Growth Across Business Segments"
48,AMZN,2024-10-13,08:08AM,Prediction: Amazon.com Will Lose Money on Project Kuiper
49,AMZN,2024-10-13,05:01AM,"Meet the Stock-Split Stock That Soared 10,720% Over the Past 15 Years. Now, It's Poised to Join Apple, Nvidia, Microsoft, Alphabet, Amazon, and Meta in the $1 Trillion Club"
50,AMZN,2024-10-13,04:49AM,"What's the Best ""Magnificent Seven"" Stock to Buy if Trump Wins in November?"
51,AMZN,2024-10-12,05:48PM,Amazons Tye Brady discusses the next generation of robotic warehouses
52,AMZN,2024-10-12,12:00PM,How Amazon changes local economies when it moves in
53,AMZN,2024-10-12,09:49AM,Amazon.com Inc (AMZN): Most Promising Growth Stock According to Hedge Funds
54,AMZN,2024-10-12,09:00AM,Will the Fed's Rate Cuts Actually Lead to Lower Prices?
55,AMZN,2024-10-12,08:45AM,2 Monster Stocks That Are Crushing the S&P 500 This Year
56,AMZN,2024-10-12,08:33AM,Cathie Wood buys $15 million of soaring mega-cap tech stocks
57,AMZN,2024-10-12,08:05AM,Amazon Day Symposium gives Evercore incremental confidence
58,AMZN,2024-10-12,08:00AM,"ETF Investors Shrug Off Market Uncertainties, Bullish on Mag 7, Schwab Survey Finds"
59,AMZN,2024-10-12,07:53AM,Prediction: Meta Platforms Will Be Worth More Than Alphabet and Amazon by 2026
60,AMZN,2024-10-12,07:13AM,"Scotiabank Initiates Outperform Rating for Amazon.com, Inc. (AMZN), Predicts Growth Driven by AI Innovations"
61,AMZN,2024-10-12,05:00AM,"Amazon's AI for delivery, Microsoft's healthcare agents, and Writer's model: This week in new AI launches"
62,AMZN,2024-10-11,04:03PM,Treasury Yields Have Been Rising. How Might That Affect Your Stock Portfolio?
63,AMZN,2024-10-11,03:44PM,Retailers step up to provide hurricane relief
64,AMZN,2024-10-11,02:59PM,Amazon's AI-Driven AWS Growth To Power Outperformance: Analysts
65,AMZN,2024-10-11,12:52PM,"Scotiabank Starts big tech coverage: Amazon and Google Outperform, Meta Neutral"
66,AMZN,2024-10-11,12:49PM,Amazon Stock Gets 2 New Buy Ratings. Why Analysts Are So Bullish.
67,AMZN,2024-10-11,12:20PM,Amazon makes three new Climate Pledge Fund investments
68,AMZN,2024-10-11,10:59AM,"Tesla unveils Cybercab, humanoid robots at robotaxi event"
69,AMZN,2024-10-11,10:15AM,JFrog Stock Hops On Report Of Potential Takeover Interest
70,AMZN,2024-10-11,09:00AM,Brad Gerstner on Amazon (AMZN): CEO Andy Jassy is in Animal Mode Amid Threats from Microsoft (MSFT)
71,AMZN,2024-10-11,08:42AM,Three reasons Amazon Prime Big Deal Days bodes well for the holidays
72,AMZN,2024-10-11,08:21AM,The Weekly Closeout: Primark plans a Manhattan flagship and Walmart expands pet offerings
73,AMZN,2024-10-11,08:00AM,AI 'Godfather' Yoshua Bengio: We're 'creating monsters more powerful than us'
74,AMZN,2024-10-11,07:30AM,Why Amazons Zoox is taking a different approach to autonomous taxis
75,AMZN,2024-10-11,07:06AM,"Pivotal Research begins Amazon coverage, sees strong growth with $260 PT"
76,AMZN,2024-10-11,07:06AM,"Amazon.com, Inc. (AMZN) Teams Up with Smartsheet to Enhance AI Assistant Amazon Q Business with New Data Connector"
77,AMZN,2024-10-11,04:02AM,"Meet the Unstoppable Growth Stock That Could Join Apple, Nvidia, and Microsoft in the $3 Trillion Club by 2029"
78,AMZN,2024-10-11,03:30AM,The S&P 500 Usually Goes Up in the 4th Quarter: 2 Stocks to Buy Now That Are Highly Rated by Wall Street
79,AMZN,2024-10-11,03:05AM,Prediction: Here Is What Apple Might Do to Catch Up in the Artificial Intelligence (AI) Revolution
80,AMZN,2024-10-10,07:25PM,"Jeff Bezos-Led Amazon Almost Ran Out Of Cash 24 Years Ago. At $400B, It Is Now Projected To Have As Much Cash As Apple And Microsoft Combined By 2027: Here's More"
81,AMZN,2024-10-10,04:01PM,Wall Street Has Set a Low Bar for Earnings. Is That a Good Omen for Your Portfolio?
82,AMZN,2024-10-10,02:33PM,"Cramer Says Amazon.com, Inc. (NASDAQ:AMZN) Always Comes Back"
83,AMZN,2024-10-10,02:10PM,Amazon's second Prime Day was a big success
84,AMZN,2024-10-10,01:54PM,Amazon Sets an October Event Sales Record as Retailers Eye the Holiday Season
85,AMZN,2024-10-10,01:27PM,"Amazon, Whole Foods, and Amazon Fresh join forces"
86,AMZN,2024-10-10,12:07PM,"Amazon unveils innovations in delivery, robotics and sustainability"
87,AMZN,2024-10-10,11:32AM,Teslas (TSLA) Robotaxi Launch Comes with Opportunities and Risks
88,AMZN,2024-10-10,10:55AM,Is Amazon.com Inc. (AMZN) the Best Quality Stock to Buy According to Analysts?
89,AMZN,2024-10-10,10:49AM,"Apple TV+ Joins Prime Video as Add-on, Expanding Streaming Reach"
90,AMZN,2024-10-10,10:48AM,Amazon Stock Retakes Key Level As E-Commerce Giant Reports 'Record' October Deals Event
91,AMZN,2024-10-10,10:38AM,Amazon has biggest October sale ever; Holiday Beauty Haul up next
92,AMZN,2024-10-10,10:34AM,"Truist upgrades Nike stock to Buy, says new management can reignite interest"
93,AMZN,2024-10-10,09:00AM,Amazons Prime Big Deal Days was the Companys Biggest October Shopping Event Ever
94,AMZN,2024-10-10,08:50AM,Amazon.com price target lowered to $210 from $230 at Cantor Fitzgerald
95,AMZN,2024-10-10,08:44AM,AMD's AI product event likely to be 'a fade-the-news event' says analyst
96,AMZN,2024-10-10,08:41AM,Alphyn Capital Management: Amazon.com (AMZN) is Heavily Investing in its AWS Infrastructure
97,AMZN,2024-10-10,08:38AM,Amazon introduces mobile AI shopping guides
98,AMZN,2024-10-10,08:25AM,"Amazon Pharmacy to Double Service Areas, Offer Same-Day Medication Delivery"
99,AMZN,2024-10-10,08:20AM,Amazon Prime Video will soon have Apple TV+ because streaming is just cable now
100,AMZN,2024-10-10,06:52AM,"Amazon to deploy AI package retrieval tech on 1,000 electric vans"
101,AMZN,2024-10-10,06:30AM,Microsoft Just Got Downgraded -- and It All Has to Do With Nvidia
102,AMZN,2024-10-10,05:33AM,Jensen Huang Just Delivered Incredible News for Nvidia Stock Investors
103,GOOG,2024-10-15,07:05PM,Googles Nuclear Deal Points to a Promising New Group of Stocks
104,GOOG,2024-10-15,06:40PM,Trump Says He Wont Break Up Google
105,GOOG,2024-10-15,05:25PM,Trump Defends Tariff Plan While Pressing for More Fed Influence
106,GOOG,2024-10-15,04:13PM,Google signed a deal to power data centers with nuclear micro-reactors from Kairos  but the 2030 timeline is very optimistic
107,GOOG,2024-10-15,03:08PM,Tesla Fails To Justify The Robotaxi Hype With Concrete Figures
109,GOOG,2024-10-15,02:49PM,Startup that wants to be the eBay for AI data taps Google vets and a top IP lawyer for key roles
110,GOOG,2024-10-15,02:04PM,"OpenAIs lead over other AI companies has largely vanished, State of AI report finds"
111,GOOG,2024-10-15,01:17PM,Google Parent Alphabet Should Trade At A Premium Versus Peers: Analyst
112,GOOG,2024-10-15,01:05PM,Google supercharges Shopping tab with AI and personalized recommendation feed
113,GOOG,2024-10-15,01:01PM,Yacktman Fund's Strategic Moves: A Deep Dive into Alphabet Inc's Impact
114,GOOG,2024-10-15,12:01PM,Yacktman Focused Fund's Strategic Moves: A Deep Dive into Alphabet Inc's Impact
115,GOOG,2024-10-15,11:57AM,"Google Redesigns Shopping Page With Infinite Scroll, Video"
116,GOOG,2024-10-15,11:51AM,Sam Altman-backed Oklo reacts to Google's nuclear energy deal
117,GOOG,2024-10-15,11:29AM,"Google Unveils Redesigned, AI-Powered U.S. Shopping Website"
118,GOOG,2024-10-15,11:09AM,Google signs deal with nuclear power startup Kairos Power
120,GOOG,2024-10-15,11:05AM,Google will help build seven nuclear reactors to power its AI systems
121,GOOG,2024-10-15,10:21AM,Google Is Kickstarting the Era of AI Shopping
122,GOOG,2024-10-15,09:05AM,Alphabet Goes Nuclear. Is Google Stock A Buy Or Sell?
123,GOOG,2024-10-15,09:00AM,Google Shopping is getting an AI upgrade as Alphabet looks to monetize investments
124,GOOG,2024-10-15,08:55AM,Italy in talks with Google over bases for submarine network in Sicily
125,GOOG,2024-10-15,08:45AM,Nvidia's 84% Expected Profit Growth Looms Large In S&P 500
126,GOOG,2024-10-15,08:30AM,Here's Why 2 Artificial Intelligence (AI) Stocks Slumped Recently. Time to Buy the Dip?
127,GOOG,2024-10-15,08:02AM,Google is going nuclear to power AI
128,GOOG,2024-10-15,07:58AM,5 Things to Know Before the Stock Market Opens
129,GOOG,2024-10-15,06:57AM,"Nvidia Rally Has Legs. Why It Can Defy China Fears, Rival AI Chips and 5 Other Things to Know Today."
130,GOOG,2024-10-15,06:23AM,Google Joins Big Tech's Pivot To Nuclear Energy To Power AI
131,GOOG,2024-10-15,06:21AM,Is Tesla losing the robotaxi race?
132,GOOG,2024-10-15,04:54AM,Google signs deal with Kairos for 500MW nuclear projects by 2035
133,GOOG,2024-10-14,06:57PM,"Google Bets Big on Nuclear, Inks Deal with Kairos Power for 500-MW SMR Fleet to Power Data Centers"
134,GOOG,2024-10-14,06:44PM,Why NuScale Power Stock Was a Winner Today
136,GOOG,2024-10-14,05:45PM,Alphabet Inc. (GOOG) Beats Stock Market Upswing: What Investors Need to Know
137,GOOG,2024-10-14,05:23PM,Nvidia and other chip stocks surge with no sign of AI spending slowdown  for now
138,GOOG,2024-10-14,05:17PM,S&P 500 Gains and Losses Today: AI Plays Help Lift Index to Record Close
139,GOOG,2024-10-14,05:11PM,Google Goes Nuclear to Power Its AI Ambitions
140,GOOG,2024-10-14,04:22PM,Google to back building of nuclear reactors for data centers
141,GOOG,2024-10-14,04:22PM,Nvidia Stock Hits Record Closing High on Growing Optimism About AI Demand
142,GOOG,2024-10-14,04:05PM,Google announces nuclear energy partnership with Kairos Power
143,GOOG,2024-10-14,03:51PM,"Google's Rising Capex May Hit Q4 Earnings, but AI Remains a Bright Spot, Says Baird"
144,GOOG,2024-10-14,03:07PM,"DOJ Targets Google for Antitrust Violations, Proposes Breakup of Search Giant"
145,GOOG,2024-10-14,03:06PM,Google orders small modular nuclear reactors for its data centres
146,GOOG,2024-10-14,03:03PM,Google to buy power for AI needs from small modular nuclear reactor company Kairos
147,GOOG,2024-10-14,03:02PM,Alphabet Inc. (GOOGL): Most Promising Growth Stock According to Hedge Funds
148,GOOG,2024-10-14,01:39PM,Watch These Uber Price Levels as Stock Near Record High After Tesla's Robotaxi Reveal
149,GOOG,2024-10-14,09:04AM,Former SEC Chair Jay Clayton: I'm not in favor of a potential breakup of Google
150,GOOG,2024-10-14,08:55AM,Alphabet Inc. (GOOG): A Top Holding in George Soross Portfolio
151,GOOG,2024-10-14,08:00AM,Unlocking Intrinsic Value: Analysis of Alphabet Inc
152,GOOG,2024-10-14,07:55AM,"Will AI Agents Make Software Companies Artificial Intelligence Winners, Like Nvidia?"
153,GOOG,2024-10-14,07:53AM,Google seeks stay against app store competition order
154,GOOG,2024-10-14,07:15AM,My 4 Best Stocks to Buy Right Now
155,GOOG,2024-10-14,07:10AM,"Google wants U.S. judges app store ruling put on hold, Reuters reports"
156,GOOG,2024-10-14,02:49AM,Google Search Volumes in Bitcoin Wanes as Memecoins Steal Spotlight in 2024
157,GOOG,2024-10-13,03:50PM,Alphabet Inc. (GOOGL): Hedge Funds Are Bullish On This Profitable Blue Chip Stock Right Now
158,GOOG,2024-10-13,10:23AM,Alphabet Inc. (NASDAQ:GOOG) Is A Goldman Sachs Phase 2 AI Stock For The Next AI Wave
159,GOOG,2024-10-13,10:03AM,Google's new antitrust defense is AI
160,GOOG,2024-10-13,07:18AM,Alphabet Inc. (GOOG) Maintains Buy Rating Amid DOJ Case Concerns; Bank of America Sees Strong Positioning and Positive Cost Basis for EPS Growth
161,GOOG,2024-10-13,05:01AM,"Meet the Stock-Split Stock That Soared 10,720% Over the Past 15 Years. Now, It's Poised to Join Apple, Nvidia, Microsoft, Alphabet, Amazon, and Meta in the $1 Trillion Club"
162,GOOG,2024-10-13,05:00AM,Fate of Lina Khans Bid to Reshape Antitrust Comes Down to Election
163,GOOG,2024-10-13,04:49AM,"What's the Best ""Magnificent Seven"" Stock to Buy if Trump Wins in November?"
164,GOOG,2024-10-13,03:01AM,A Google Breakup Could Be Coming. Is Alphabet Stock a Buy?
165,GOOG,2024-10-12,12:56PM,"Almost everyone offered a job at Google accepts, and the CEO explains what it looks for in new hires"
166,GOOG,2024-10-12,09:30AM,Tesla Leaves Uber Plenty of Road
167,GOOG,2024-10-12,09:00AM,"Breaking up Google, Tesla's robotaxi reveal, and everything Nvidia: Tech news roundup"
168,GOOG,2024-10-12,08:00AM,"ETF Investors Shrug Off Market Uncertainties, Bullish on Mag 7, Schwab Survey Finds"
169,GOOG,2024-10-12,07:53AM,Prediction: Meta Platforms Will Be Worth More Than Alphabet and Amazon by 2026
170,GOOG,2024-10-12,07:48AM,Google wants US judge's app store ruling put on hold
171,GOOG,2024-10-12,06:53AM,"JPMorgan Maintains Overweight on Alphabet Inc. (GOOG) Amid DOJ Trial, Citing Possible Structural Changes but Minimal Near-Term Impact"
172,GOOG,2024-10-12,05:10AM,"1 Artificial Intelligence (AI) Stock-Split Stock Set to Join Nvidia, Apple, Microsoft, Amazon, Alphabet, and Meta in the $1 Trillion Club"
173,GOOG,2024-10-12,04:07AM,Surprise! These 3 High-Growth Artificial Intelligence (AI) Players Are Looking More and More Like Value Stocks
174,GOOG,2024-10-12,04:00AM,"Trumps new campaign pledge on autonomous EVs is good for Musk and Waymo, bad for China"
175,GOOG,2024-10-12,03:00AM,AI Researchers Won 2 Nobel Prizes. Why They Disagree on the Technologys Risks.
176,GOOG,2024-10-11,06:00PM,Musks Robotaxi Reveal Is a Dud for Investors
177,GOOG,2024-10-11,05:19PM,"The Score: Tesla, Alphabet, JPMorgan Chase and More Stocks That Defined the Week"
178,GOOG,2024-10-11,04:22PM,Why Tesla's robotaxi technology lags behind Waymo and Cruise
179,GOOG,2024-10-11,04:03PM,Treasury Yields Have Been Rising. How Might That Affect Your Stock Portfolio?
180,GOOG,2024-10-11,01:55PM,"Google Set To Lead AI Wave, Sees Positive Outlook Ahead Despite Antitrust Actions Impact"
181,GOOG,2024-10-11,01:00PM,Billionaire Ray Dalio Is Skeptical Of The Recent Rate Cuts  These Are The Stocks He's Holding
182,GOOG,2024-10-11,12:52PM,"Scotiabank Starts big tech coverage: Amazon and Google Outperform, Meta Neutral"
183,GOOG,2024-10-11,12:32PM,"Google Used Influence, Ultimatum to Cut California News Deal"
184,GOOG,2024-10-11,11:01AM,"Facing skepticism, Elon Musk unveils prototype for driverless robotaxi"
185,GOOG,2024-10-11,09:58AM,Google Could Lose Exclusivity Deals. Citi Says Apple Will Be Fine Without Them.
186,GOOG,2024-10-11,09:39AM,Analyst Sees 26% Upside to Alphabet (GOOG) After New AI Agents Launch
187,GOOG,2024-10-11,09:30AM,Traveling Home for Christmas? Here's When to Book for Cheap Flights
188,GOOG,2024-10-11,09:13AM,What About Waymo?
189,GOOG,2024-10-11,08:00AM,AI 'Godfather' Yoshua Bengio: We're 'creating monsters more powerful than us'
190,GOOG,2024-10-11,07:58AM,Heres Why Alphabet (GOOG) Fell in Q3
191,GOOG,2024-10-11,07:30AM,Why Amazons Zoox is taking a different approach to autonomous taxis
192,GOOG,2024-10-11,07:19AM,"AI update: Google Gemini leads LLMs, SLMs on the rise, chip wars heat up"
193,GOOG,2024-10-11,07:15AM,Prediction: 3 Stocks That'll Be Worth More Than Apple 5 Years From Now
194,GOOG,2024-10-11,07:03AM,"Indonesia asks Apple, Google to block China's Temu to protect small merchants"
195,GOOG,2024-10-11,06:01AM,Alphabet Inc. (GOOG) Partners with Sequoia Capital to Offer AI Startups Up to $500K in Free Cloud Services
196,GOOG,2024-10-11,04:02AM,"Meet the Unstoppable Growth Stock That Could Join Apple, Nvidia, and Microsoft in the $3 Trillion Club by 2029"
197,GOOG,2024-10-11,04:00AM,How Investing Pros Are Playing the Magnificent 7 Now
198,GOOG,2024-10-10,10:12PM,AI is having its Nobel moment. Do scientists need the tech industry to sustain it?
199,GOOG,2024-10-10,09:37PM,Nvidia H200's greatest rival: AMD MI325X GPU
200,GOOG,2024-10-10,05:37PM,5 Things Musk Needs to Do for Robotaxi Day to Be a Success
201,GOOG,2024-10-10,05:22PM,Why this investor is skeptical about Tesla's robotaxi event
202,GOOG,2024-10-10,04:01PM,Wall Street Has Set a Low Bar for Earnings. Is That a Good Omen for Your Portfolio?
203,GOOG,2024-10-10,03:12PM,AMD Launches New AI Chips To Meet 'Insatiable' AI Demand
204,GOOG,2024-10-10,01:35PM,Trump Media's Stock Has Jumped From Its Recent Lows
205,GOOG,2024-10-10,12:08PM,Dunelm and OnBuy leverage Google Cloud to boost customer experience
206,AAPL,2024-10-15,10:47PM,Largan reportedly to address iPhone 16 shipment concerns at October 17 earnings call
207,AAPL,2024-10-15,05:03PM,How to Have the Most Challenging Financial Conversations in Our Lives
208,AAPL,2024-10-15,04:33PM,Apple Stock Closes Just Shy of a Record High. The iPhone Outlook Might Be Shifting.
209,AAPL,2024-10-15,04:03PM,Apple Stock Rises to Fresh Record as Company Announces New iPad Mini
210,AAPL,2024-10-15,03:01PM,Apple Stock Is on the Cusp of a Record High. The iPhone Outlook Might Be Shifting.
212,AAPL,2024-10-15,02:50PM,Jim Cramer Acknowledges Apple Inc (NASDAQ:AAPL) is Facing Near-Term Headwinds
213,AAPL,2024-10-15,01:26PM,Nvidia Inches Closer to Overtaking Apple in Market Value
214,AAPL,2024-10-15,01:26PM,Strong Demand for iPhone 16 Pro and Pro Max Drives Lead Times Up
215,AAPL,2024-10-15,01:25PM,Apple Launches AI-Enhanced iPad Mini with A17 Pro
216,AAPL,2024-10-15,01:15PM,Bill Gates Saved 'Rival' Apple From Bankruptcy By Investing $150 Million  Steve Jobs Thanked Him Publicly: 'The World's A Better Place'
217,AAPL,2024-10-15,12:43PM,"Apple stock hits record intraday high, first since July"
218,AAPL,2024-10-15,12:17PM,Truth Social Stock Jumps as Election Prediction Markets Drift Toward Trump
219,AAPL,2024-10-15,12:07PM,"Apple, IBD Stock Of The Day, Breaks Out After iPad Mini Reveal"
220,AAPL,2024-10-15,11:34AM,Apple unveils new iPad Mini with AI capabilities
221,AAPL,2024-10-15,10:55AM,Apple launches new iPad mini with AI features
223,AAPL,2024-10-15,10:44AM,Cramer's Stop Trading: Apple
224,AAPL,2024-10-15,10:37AM,Warren Buffett Stocks: What's Inside Berkshire Hathaway's Portfolio?
225,AAPL,2024-10-15,10:23AM,Apple Stock Hits Record on Optimism AI Will Spur iPhone Sales
226,AAPL,2024-10-15,10:22AM,Apple Introduces a New iPad Mini Ahead of AI Software Launch
227,AAPL,2024-10-15,09:00AM,Apple introduces powerful new iPad mini built for Apple Intelligence
228,AAPL,2024-10-15,07:58AM,5 Things to Know Before the Stock Market Opens
229,AAPL,2024-10-15,07:32AM,Goldman profits surge 45% as dealmaking stages comeback
230,AAPL,2024-10-15,07:32AM,'Soft landing' optimism spurs broad Wall Street rebound at big banks
231,AAPL,2024-10-15,07:30AM,Apple Poured $1B A Year Into Its Car Project Before Abandoning It. Tim Cook's Company Now Pulls Plug On Autonomous Vehicle Testing Permit In California: Here's More
232,AAPL,2024-10-14,05:45PM,Apple (AAPL) Exceeds Market Returns: Some Facts to Consider
233,AAPL,2024-10-14,04:51PM,Nvidia Stock Hits Its Highest Closing Price. The Chip Designer Could Soon Be Worth More Than Apple.
234,AAPL,2024-10-14,04:27PM,Why Apple Stock Was Added To 'Tactical Outperform' List Ahead Of Earnings
235,AAPL,2024-10-14,04:22PM,Nvidia Stock Hits Record Closing High on Growing Optimism About AI Demand
236,AAPL,2024-10-14,04:10PM,Nvidia Stock Tops Its Record. Whats Driving Shares Higher.
237,AAPL,2024-10-14,03:40PM,"Huawei could be a threat to Apple in China, says Evercore ISI's Amit Daryanani"
239,AAPL,2024-10-14,02:51PM,Apple Inc. (AAPL): Most Promising Growth Stock According to Hedge Funds
240,AAPL,2024-10-14,02:32PM,Nvidia Stock Is Chasing a Recordand Apple. Whats Driving Shares Higher.
241,AAPL,2024-10-14,02:21PM,Apple Intelligence features can also summarize breakup texts for you
242,AAPL,2024-10-14,01:21PM,How to separate earnings winners from losers: Asset manager
243,AAPL,2024-10-14,01:10PM,"Nvidia notches record close, could unseat Apple as most valuable company"
244,AAPL,2024-10-14,12:42PM,"Analysts revisit Apple stock ratings on iPhone demand, expectations"
245,AAPL,2024-10-14,12:42PM,Analyst resets Apple stock forecast on demand trends
246,AAPL,2024-10-14,11:59AM,Magnificent Seven Stocks: Nvidia Stock Rallies Near Record Highs
247,AAPL,2024-10-14,11:45AM,Apple (AAPL): Leading the Pack Among the Most Profitable Tech Stocks Right Now
248,AAPL,2024-10-14,11:41AM,Nvidia Stock Is on Track for a Record. Its Close to Catching Apple.
249,AAPL,2024-10-14,11:33AM,Apple Stock Has Stalled. Why This Analyst Calls It a Tactical Outperform.
250,AAPL,2024-10-14,11:04AM,Cramer's Stop Trading: Apple
251,AAPL,2024-10-14,10:42AM,Apple Stock Added To 'Tactical Outperform' List Ahead Of Earnings
252,AAPL,2024-10-14,09:32AM,Apples hearing aid software could change how we deal with hearing loss forever
253,AAPL,2024-10-14,09:00AM,Is Most-Watched Stock Apple Inc. (AAPL) Worth Betting on Now?
254,AAPL,2024-10-14,08:42AM,Nvidia Stock Rises. Its Getting Closer to Catching Apple.
255,AAPL,2024-10-14,08:00AM,The Art of Valuation: Discovering Apple Inc's Intrinsic Value
256,AAPL,2024-10-14,05:59AM,2 Warren Buffett Stocks to Buy Hand Over Fist
257,AAPL,2024-10-14,05:41AM,Nvidia Stock Closer to Overtaking Apple as Most Valuable Company. How It Gets There.
258,AAPL,2024-10-14,04:28AM,"Want to Buy Nvidia, Microsoft, and Apple? Consider This Vanguard Growth ETF"
259,AAPL,2024-10-13,09:50PM,Apple set to unveil new Mac and iPad models in October
260,AAPL,2024-10-13,03:48PM,Apple Inc. (AAPL): Hedge Funds Are Bullish On This Profitable Blue Chip Stock Right Now
261,AAPL,2024-10-13,02:50PM,Meta Files an Orion-Centric Smartglasses Patent covering Single Pixel 3D Retinal Imaging
262,AAPL,2024-10-13,12:02PM,Apple has won a series of Design Patents in Hong Kong & Europe while filing for new Trademarks in the U.S. for 'Apple M4' and more
263,AAPL,2024-10-13,10:39AM,Apple to Breathe new Life into their Smart Home Strategy with new AI driven devices + we may see basic Smartglasses surfacing by 2027
264,AAPL,2024-10-13,07:56AM,"Apple Inc. (AAPL): Piper Sandler Maintains Neutral Rating, Teen Survey Shows Moderate Upgrade Expectations"
265,AAPL,2024-10-13,05:56AM,Should You Buy Apple Stock Before Oct. 28?
