,ticker,date,time,title
266,AAPL,2024-10-13,05:30AM,"Apple Headset Stalls, Struggles to Attract Killer Apps in First Year"
267,AAPL,2024-10-13,05:01AM,"Meet the Stock-Split Stock That Soared 10,720% Over the Past 15 Years. Now, It's Poised to Join Apple, Nvidia, Microsoft, Alphabet, Amazon, and Meta in the $1 Trillion Club"
268,AAPL,2024-10-13,04:49AM,"What's the Best ""Magnificent Seven"" Stock to Buy if Trump Wins in November?"
269,AAPL,2024-10-13,03:01AM,A Google Breakup Could Be Coming. Is Alphabet Stock a Buy?
270,AAPL,2024-10-13,03:00AM,"Czech National Bank Bought Up Palantir, Nvidia, Apple, and Berkshire Stock"
271,AAPL,2024-10-12,11:05AM,"Berkshire Hathaway: Buy, Sell, or Hold?"
272,AAPL,2024-10-12,10:00AM,This week in Bidenomics: The 'election trade' is on
273,AAPL,2024-10-12,08:00AM,"ETF Investors Shrug Off Market Uncertainties, Bullish on Mag 7, Schwab Survey Finds"
274,AAPL,2024-10-12,07:53AM,Prediction: Meta Platforms Will Be Worth More Than Alphabet and Amazon by 2026
275,AAPL,2024-10-12,07:01AM,"Apple Inc. (AAPL) Set to Launch iOS 18.1 and Apple Intelligence, Shifting from Annual Upgrade Cycle Amid Concerns Over iPhone Demand"
276,AAPL,2024-10-12,05:10AM,"1 Artificial Intelligence (AI) Stock-Split Stock Set to Join Nvidia, Apple, Microsoft, Amazon, Alphabet, and Meta in the $1 Trillion Club"
277,AAPL,2024-10-11,06:09PM,Why Affirm Holdings Stock Leaped 12% Higher Today
278,AAPL,2024-10-11,04:45PM,"Thoughts on Apple's NBA All-Star Weekend Film in Apple Immersive Video, Apple Immersive Video and Sports Questions, The Big Picture"
279,AAPL,2024-10-11,04:03PM,Treasury Yields Have Been Rising. How Might That Affect Your Stock Portfolio?
280,AAPL,2024-10-11,03:12PM,Apple Launches Largest Overseas R&D Lab in Shenzhen Amid Growing Competition from Huawei
281,AAPL,2024-10-11,10:55AM,China Probes Taiwan Staff at iPhone City for Alleged Bribery
282,AAPL,2024-10-11,10:25AM,Analysts Note an Unexpected Positive Development on Apple (AAPL) iPhone 16 Demand Trends
283,AAPL,2024-10-11,10:14AM,Apple CEO Tim Cook Sold Out Over $50 Million in Stock Amid Performance Evaluations
284,AAPL,2024-10-11,09:58AM,Google Could Lose Exclusivity Deals. Citi Says Apple Will Be Fine Without Them.
285,AAPL,2024-10-11,08:00AM,AI 'Godfather' Yoshua Bengio: We're 'creating monsters more powerful than us'
286,AAPL,2024-10-11,07:15AM,Prediction: 3 Stocks That'll Be Worth More Than Apple 5 Years From Now
287,AAPL,2024-10-11,07:03AM,"Indonesia asks Apple, Google to block China's Temu to protect small merchants"
288,AAPL,2024-10-11,06:14AM,"Jefferies Downgrades Apple Inc. (AAPL) to Hold, Citing Need for Smartphone Hardware Overhaul Before AI Integration"
289,AAPL,2024-10-11,05:06AM,"This Is the One Stock Warren Buffett Keeps Buying, Regardless of Valuation"
290,AAPL,2024-10-11,04:59AM,1 Unstoppable Vanguard ETF to Buy During the S&P 500 Bull Market
291,AAPL,2024-10-11,04:11AM,Should You Buy Apple Stock Now or Wait for a Dip?
292,AAPL,2024-10-11,04:02AM,"Meet the Unstoppable Growth Stock That Could Join Apple, Nvidia, and Microsoft in the $3 Trillion Club by 2029"
293,AAPL,2024-10-11,04:00AM,How Investing Pros Are Playing the Magnificent 7 Now
294,AAPL,2024-10-11,03:05AM,Prediction: Here Is What Apple Might Do to Catch Up in the Artificial Intelligence (AI) Revolution
295,AAPL,2024-10-10,08:16PM,Huawei and Apple's latest smartphone sales battle it out in Shanghai flagship stores
296,AAPL,2024-10-10,08:03PM,Veteran investor connects with Taiwan Semiconductor after sales
297,AAPL,2024-10-10,07:39PM,Is Apple Inc. (NASDAQ:AAPL) The Most Popular Stock Among Mutual Funds According To Goldman Sachs?
298,AAPL,2024-10-10,07:25PM,"Jeff Bezos-Led Amazon Almost Ran Out Of Cash 24 Years Ago. At $400B, It Is Now Projected To Have As Much Cash As Apple And Microsoft Combined By 2027: Here's More"
299,AAPL,2024-10-10,04:51PM,Apple CEO Tim Cook Just Sold $50 Million of Stock. Its Part of a Two-Year Plan.
300,AAPL,2024-10-10,04:34PM,"Apple Stock Downgraded, Needs Time To 'Ripen'"
301,AAPL,2024-10-10,04:30PM,Invest in the 'Apple II Moment' for Autonomous Vehicles
302,AAPL,2024-10-10,03:48PM,One Tech Tip: Here's what you need to do before and after your phone is stolen or lost
303,AAPL,2024-10-10,03:25PM,"Apple Releases First Scripted Film in Apple Immersive Video, Thoughts After Watching  Submerged,  The Future of Video"
304,AAPL,2024-10-10,02:33PM,Cramer On Apple Inc. (NASDAQ:AAPL): Own It
305,AAPL,2024-10-10,10:53AM,iPhone 16 Pro Meets Sales Expectations as Base Models Face Softer Demand
306,AAPL,2024-10-10,10:49AM,"Apple TV+ Joins Prime Video as Add-on, Expanding Streaming Reach"
307,AAPL,2024-10-10,08:20AM,Amazon Prime Video will soon have Apple TV+ because streaming is just cable now
308,AAPL,2024-10-10,07:10AM,China Detains Four Taiwanese Employees at Apples iPhone City
309,JPM,2024-10-15,12:04AM,Exclusive-Jamie Dimon charts JPMorgan expansion plan into Africa
310,JPM,2024-10-15,07:33PM,Goldman Sachs execs flag a growing trend that's affecting its business
311,JPM,2024-10-15,05:04PM,JPMorgan Chase & Co's Strategic Acquisition of Yum Brands Shares
312,JPM,2024-10-15,05:03PM,JPMorgan Chase & Co.'s Strategic Acquisition of Western Digital Shares
313,JPM,2024-10-15,05:03PM,JPMorgan Chase & Co's Strategic Acquisition of Warner Music Group Shares
315,JPM,2024-10-15,05:03PM,JPMorgan Chase & Co. Increases Stake in Vicor Corp
316,JPM,2024-10-15,05:03PM,JPMorgan Chase & Co.'s Strategic Reduction in Ventas Inc Holdings
317,JPM,2024-10-15,05:03PM,JPMorgan Chase & Co. Reduces Stake in The Travelers Companies Inc.
318,JPM,2024-10-15,05:02PM,JPMorgan Chase & Co's Strategic Acquisition in Regency Centers Corp
319,JPM,2024-10-15,04:39PM,JPMorgan Sells $8 Billion of Corporate Bonds After Earnings
320,JPM,2024-10-15,04:34PM,JPMorganChase Declares Preferred Stock Dividends
321,JPM,2024-10-15,04:17PM,Three Things We Learned From Big Bank Q3 Earnings
322,JPM,2024-10-15,03:59PM,Citi's performance was 'a little sluggish': Analyst on earnings
323,JPM,2024-10-15,02:04PM,Three Big Takeaways From Bank Earnings
324,JPM,2024-10-15,11:50AM,Lower interest rates will change the game for big banks. Here's how
326,JPM,2024-10-15,11:50AM,"2Gether-International and JPMorganChase Partner on 'Venture Labs,' a Pre-Accelerator Program for Idea-Stage Founders with Disabilities"
327,JPM,2024-10-15,11:00AM,J.P. Morgan Private Capital Hires Paris Heymann to Expand Technology Investment Capabilities
328,JPM,2024-10-15,09:00AM,Here is What to Know Beyond Why JPMorgan Chase & Co. (JPM) is a Trending Stock
329,JPM,2024-10-15,07:58AM,5 Things to Know Before the Stock Market Opens
330,JPM,2024-10-15,07:42AM,Goldman Sachs Stock Rises as Results Surpass Estimates
331,JPM,2024-10-15,07:32AM,Goldman profits surge 45% as dealmaking stages comeback
332,JPM,2024-10-15,07:32AM,'Soft landing' optimism spurs broad Wall Street rebound at big banks
333,JPM,2024-10-15,07:12AM,"J.P. Morgan, Capital One Commit $260MM to Arizona Solar Project"
334,JPM,2024-10-15,07:04AM,Bank of America Joins Rivals in Topping Q3 Estimates
335,JPM,2024-10-14,08:41PM,"If the Fed cuts more slowly, that's good for JPMorgan, says Jim Cramer"
336,JPM,2024-10-14,05:23PM,Nvidia and other chip stocks surge with no sign of AI spending slowdown  for now
337,JPM,2024-10-14,04:59PM,"What to expect from bank earnings: BofA, Citi, Goldman"
338,JPM,2024-10-14,10:52AM,"JPMorgan Hires Paris Heymann for Venture, Growth-Equity Bets"
339,JPM,2024-10-14,10:38AM,"Nvidia stock eyes record high, looks to unseat Apple as world's most valuable company"
340,JPM,2024-10-14,10:38AM,Nvidia stock eyes record high to unseat Apple as world's most valuable company
342,JPM,2024-10-14,08:27AM,"JPMorgan Chase (JPM) Expands with First Republic Bank Acquisition, Boosting Earnings"
343,JPM,2024-10-14,08:00AM,Invest with Confidence: Intrinsic Value Unveiled of JPMorgan Chase & Co
344,JPM,2024-10-14,06:45AM,Opening Day: Another trio of biotech IPOs make Friday debut
345,JPM,2024-10-14,06:45AM,Global Banks Embark on a New Wave of Product Innovation Targeting Nature
346,JPM,2024-10-14,06:15AM,JPMorgan price target raised to $237 from $224 at Morgan Stanley
347,JPM,2024-10-14,06:10AM,JPMorgan price target raised to $240 from $225 at Wells Fargo
348,JPM,2024-10-14,04:53AM,4 High-Yield Dividend ETFs to Buy to Generate Passive Income
349,JPM,2024-10-12,07:00PM,JPMorgan price target raised to $251 from $237 at Goldman Sachs
350,JPM,2024-10-12,06:00AM,Soft landing or hard? Bank results show path to no landing
351,JPM,2024-10-12,03:30AM,JPMorgan and Wells Fargo Earnings Show the U.S. Economys 2 Realities
352,JPM,2024-10-12,03:00AM,JPMorgan Chase & Co (JPM) Q3 2024 Earnings Call Highlights: Strong Net Income Amid Rising ...
353,JPM,2024-10-11,05:19PM,"The Score: Tesla, Alphabet, JPMorgan Chase and More Stocks That Defined the Week"
354,JPM,2024-10-11,05:09PM,"S&P 500 Gains and Losses Today: Uber Rises, Tesla Falls After Robotaxi Event"
355,JPM,2024-10-11,04:37PM,JPMorgan Calls It: The U.S. Economy Has Made a Soft Landing
356,JPM,2024-10-11,04:17PM,"These Stocks Moved the Most Today: Tesla, Uber, JPMorgan, Wells Fargo, BlackRock, Fastenal, Affirm, and More"
357,JPM,2024-10-11,04:15PM,"JPMorgan, Wells Fargo, BlackRock, BNY Score Strong Earnings Beats"
358,JPM,2024-10-11,04:06PM,How the Fed is creating value for the Big Banks: Portfolio mgr.
359,JPM,2024-10-11,03:13PM,"JPMorgan CFO Sees NII Falling Short of $87 Billion, CEO Dimon Prioritizes Growth Over Projections"
360,JPM,2024-10-11,01:45PM,JPMorgan Chase (JPM) Q3 2024 Earnings Call Transcript
361,JPM,2024-10-11,12:51PM,"Top Stock Movers Now: JPMorgan Chase, Tesla, Uber, and More"
362,JPM,2024-10-11,12:40PM,"Falling Rates Arent as Bad as Feared for JPMorgan, Wells Fargo"
363,JPM,2024-10-11,12:40PM,"These Stocks Are Moving the Most Today: Tesla, Uber, JPMorgan, Wells Fargo, BlackRock, Fastenal, Affirm, and More"
364,JPM,2024-10-11,12:26PM,"JP Morgan has done an excellent job under Jamie Dimon's leadership, says RBC's Gerard Cassidy"
365,JPM,2024-10-11,12:25PM,Jamie Dimon warns of 'critical issues' that could affect US economy
366,JPM,2024-10-11,11:59AM,JPMorgan CEO Dimon Expresses Concern Over Geopolitical Risks
367,JPM,2024-10-11,11:58AM,Jamie Dimon on whether he could work for the next US president: 'I probably am not going to do it.'
368,JPM,2024-10-11,11:40AM,Jamie Dimon warns of treacherous geopolitical conditions that are getting worse
369,JPM,2024-10-11,11:24AM,"Why JPMorgan Chase, Bank of America, and Wells Fargo Are Trading Higher"
370,JPM,2024-10-11,11:09AM,Big Banks' Earnings Surprise Street.  Lower Rates Hurt Less Than Feared.
371,JPM,2024-10-11,11:08AM,JPMorgan to 'lead the pack back up in banks' earnings season
372,JPM,2024-10-11,10:53AM,Wells Fargo Stock Rises as Q3 Profit Falls Less Than Expected
373,JPM,2024-10-11,10:06AM,JPMorgan Beats Down Consensus Estimates
374,JPM,2024-10-11,10:01AM,U.S. Stocks Mixed as JPMorgan Chase Kicks Off Bank Earnings
375,JPM,2024-10-11,09:38AM,"JPMorgan tops Q3 earnings estimates, lifts guidance"
376,JPM,2024-10-11,09:14AM,"September PPI, Big Bank earnings, Tesla Cybercab: 3 Things"
377,JPM,2024-10-11,08:31AM,JPMorgan Forecasts Continued Strong Profits Even With Falling Rates
378,JPM,2024-10-11,08:25AM,JPMorgan Chase tops estimates for profit and revenue on better-than-expected interest income
379,JPM,2024-10-11,08:13AM,"JPMorgan Chase Q3 Earnings: Investment Banking Revenue Soars 29%, Largest Bank Raises Net Interest Income Outlook"
380,JPM,2024-10-11,08:00AM,JPMorgan Chase & Co. (JPM) Q3 Earnings and Revenues Beat Estimates
381,JPM,2024-10-11,07:39AM,JPMorgan Chase third-quarter net interest income beats estimates
382,JPM,2024-10-11,07:34AM,"JPMorgan, Wells Fargo Rise After Big Banks Kick Off Earnings, Dow Futures Perk Up"
383,JPM,2024-10-11,07:29AM,"JPMorgan, Wells Fargo Top Earnings Views; BlackRock, BNY Are Due"
384,JPM,2024-10-11,07:25AM,JPMorgan net income falls as bank sets aside more money to cover potential bad loans
385,JPM,2024-10-11,07:24AM,JPMorgan's profits fall 2% despite strong Wall Street performance
386,JPM,2024-10-11,07:23AM,JPMorgan's net income fell 2% in the third quarter as the bank set aside more money to cover potential bad loans
387,JPM,2024-10-11,07:08AM,JPMorgan Stock Rises as Q3 Earnings Handily Beat Estimates
388,JPM,2024-10-11,07:04AM,JPMorgan Chase Reports a Drop in Profit
389,JPM,2024-10-11,06:55AM,JPMorganChase Reports Third-Quarter 2024 Financial Results
390,JPM,2024-10-11,06:53AM,JPMorgan profit drops as loan loss provisions eclipse investment banking
391,JPM,2024-10-11,06:45AM,Stock Futures Down as JPMorgan Chase Kicks Off Bank Earnings This Morning
392,JPM,2024-10-11,06:34AM,Russian court orders seizure of $155.8 million in JPMorgan Chase funds in VTB lawsuit
393,JPM,2024-10-10,05:52PM,Higher interest rates could boost bank profits: Chart of the Day
394,JPM,2024-10-10,05:30PM,"JPMorgan earnings, FedSpeak, PPI data: What to Watch"
395,JPM,2024-10-10,05:10PM,"JPMorgan Expected to Report Profit, Net Interest Income Declines"
396,JPM,2024-10-10,04:22PM,"JPMorgan, Wells Fargo Face Soft Q3 Views. This Bank Is The Outlier."
397,JPM,2024-10-10,03:06PM,JPMorgan Chase & Co's Strategic Acquisition of Shares in Quanta Services Inc
398,JPM,2024-10-10,03:06PM,JPMorgan Chase & Co's Strategic Acquisition in Microchip Technology Inc
399,JPM,2024-10-10,03:06PM,JPMorgan Chase & Co.'s Strategic Acquisition of Otis Worldwide Corp Shares
400,JPM,2024-10-10,03:05PM,JPMorgan Chase & Co's Strategic Acquisition of Shares in Intra-Cellular Therapies Inc
401,JPM,2024-10-10,03:05PM,JPMorgan Chase & Co's Strategic Acquisition of HubSpot Shares
402,JPM,2024-10-10,03:05PM,JPMorgan Chase & Co's Strategic Acquisition in H World Group Ltd
403,JPM,2024-10-10,03:05PM,JPMorgan Chase & Co's Strategic Acquisition in Kyverna Therapeutics Inc
404,JPM,2024-10-10,07:43AM,"Investors should be overweight equities versus fixed income, says JPMorgan's Gabriela Santos"
405,JPM,2024-10-09,03:02PM,JPMorgan Chase & Co's Strategic Acquisition of Shares in Eagle Materials Inc
406,JPM,2024-10-09,03:02PM,JPMorgan Chase & Co.'s Strategic Reduction in Federal Realty Investment Trust Holdings
407,JPM,2024-10-09,03:02PM,JPMorgan Chase & Co's Strategic Addition to Its Portfolio with AutoZone Inc Shares
408,JPM,2024-10-09,03:02PM,JPMorgan Chase & Co's Strategic Acquisition of Corpay Inc Shares
409,JPM,2024-10-09,03:02PM,JPMorgan Chase & Co's Strategic Reduction in Arcos Dorados Holdings Inc
410,JPM,2024-10-09,03:02PM,JPMorgan Chase & Co's Strategic Acquisition in Allegro Microsystems Inc
411,JPM,2024-10-09,12:23PM,Nvidia stock steadies with record high in sight as AI boom continues
